{
  "id": "automation.notification",
  "version": "1.0.0",
  "defaultEnabled": false,
  "permissions": ["android.notificationListenerAccess"],
  "dependencies": [],
  "dataRetention": "raw text memory-only; recovery data at most 24h; structured candidates local-only",
  "networkBehavior": "none unless AI text enhancement is separately enabled"
}
